id,official_name,alias_name,total_leaf_node
01,กระทรวงกลาโหม,,320
02,กระทรวงการคลัง,,824
03,กระทรวงการต่างประเทศ,,1
04,กระทรวงการท่องเที่ยวและกีฬา,,335
05,กระทรวงการพัฒนาสังคมและความมั่นคงของมนุษย์,,378
06,กระทรวงการอุดมศึกษา วิทยาศาสตร์ วิจัยและนวัตกรรม,,2234
07,กระทรวงคมนาคม,,823
08,กระทรวงดิจิทัลเพื่อเศรษฐกิจและสังคม,,325
09,กระทรวงทรัพยากรธรรมชาติและสิ่งแวดล้อม,,996
10,กระทรวงพลังงาน,,136
11,กระทรวงพาณิชย์,,226
12,กระทรวงมหาดไทย,,2294
13,กระทรวงยุติธรรม,,739
14,กระทรวงวัฒนธรรม,,243
15,กระทรวงศึกษาธิการ,,613
16,กระทรวงสาธารณสุข,,471
17,กระทรวงอุตสาหกรรม,,289
18,กระทรวงเกษตรและสหกรณ์,,1724
19,กระทรวงแรงงาน,,492
20,กองทุนและเงินทุนหมุนเวียน,,10
21,จังหวัดและกลุ่มจังหวัด,,94
22,รัฐวิสาหกิจ,,1872
23,ศาล,,277
24,สภากาชาดไทย,,28
25,สำนักงานตำรวจแห่งชาติ,,1
26,สำนักนายกรัฐมนตรี,,652
27,ส่วนราชการในพระองค์,,1
28,ส่วนราชการไม่สังกัดสำนักนายกรัฐมนตรี กระทรวง หรือทบวง และหน่วยงานภายใต้การควบคุมดูแลของนายกรัฐมนตรี,,368
29,หน่วยงานของรัฐสภา,,65
30,หน่วยงานของศาล,,148
31,หน่วยงานขององค์กรอิสระและองค์กรอัยการ,,520
32,หน่วยงานขึ้นตรงนายกรัฐมนตรี,,363
33,หน่วยงานอิสระ,,537
34,หน่วยงานอื่นของรัฐ,,25
35,หน่วยงานอื่นๆ,,81
36,องค์กรปกครองส่วนท้องถิ่น,,78
37,องค์กรอิสระ,,105
01001,กรมทหารราบที่ 17,,1
01002,กระทรวงกลาโหม,,8
01003,กองทัพบก,,126
01004,กองทัพภาคที่ 2 กองทัพบก,,1
01005,กองทัพภาคที่ 3 (กองกำลังผาเมือง),,1
01006,กองทัพอากาศ,,54
01007,กองทัพเรือ,,54
01008,กองบัญชาการกองทัพไทย,,38
01009,บริษัท อู่กรุงเทพ จำกัด,,8
01010,สถานีวิทยุโทรทัศน์กองทัพบก,,0
01011,สถาบันเทคโนโลยีป้องกันประเทศ,,6
01012,สำนักงานปลัดกระทรวงกลาโหม,,22
01013,สำนักงานรัฐมนตรีกระทรวงกลาโหม,,1
02001,กรมธนารักษ์,,30
02002,กรมบัญชีกลาง,,101
02003,กรมศุลกากร,,75
02004,กรมสรรพสามิต,,109
02005,กรมสรรพากร,,154
02006,กองทุนการออมแห่งชาติ,,2
02007,กองทุนบำเหน็จบำนาญข้าราชการ,,3
02008,กองทุนเงินให้กู้ยืมเพื่อการศึกษา,,0
02009,คณะกรรมการส่งเสริมวิสาหกิจเริ่มต้น,,0
02010,ธนาคารกรุงไทย จำกัด (มหาชน),,1
02011,ธนาคารพัฒนาวิสาหกิจขนาดกลางและขนาดย่อมแห่งประเทศไทย,,1
02012,ธนาคารออมสิน,,1
02013,ธนาคารอาคารสงเคราะห์,,1
02014,ธนาคารอิสลามแห่งประเทศไทย,,2
02015,ธนาคารเพื่อการส่งออกและนำเข้าแห่งประเทศไทย,,1
02016,ธนาคารเพื่อการเกษตรและสหกรณ์การเกษตร,,46
02017,บรรษัทตลาดรองสินเชื่อที่อยู่อาศัย,,1
02018,บรรษัทประกันสินเชื่ออุตสาหกรรมขนาดย่อม,,1
02019,บริษัท ธนารักษ์พัฒนาสินทรัพย์ จำกัด,,12
02020,บริษัท บริหารสินทรัพย์ ธนาคารอิสลามแห่งประเทศไทย จำกัด,,13
02021,บริษัท สหโรงแรมไทยและท่องเที่ยว จำกัด,,0
02022,บริษัท อสมท จำกัด (มหาชน),,4
02023,สถาบันคุ้มครองเงินฝาก,,14
02024,สำนักงานคณะกรรมการกำกับหลักทรัพย์และตลาดหลักทรัพย์,,34
02025,สำนักงานคณะกรรมการกำกับและส่งเสริมการประกอบธุรกิจประกันภัย,['คปภ.'],130
02026,สำนักงานคณะกรรมการนโยบายรัฐวิสาหกิจ,,14
02027,สำนักงานความร่วมมือพัฒนาเศรษฐกิจกับประเทศเพื่อนบ้าน,,8
02028,สำนักงานความร่วมมือพัฒนาเศรษฐกิจกับประเทศเพื่อนบ้าน (องค์การมหาชน),,1
02029,สำนักงานบริหารหนี้สาธารณะ,,16
02030,สำนักงานปลัดกระทรวงการคลัง,,12
02031,สำนักงานรัฐมนตรี กระทรวงการคลัง,,4
02032,สำนักงานสลากกินแบ่งรัฐบาล,,16
02033,สำนักงานเศรษฐกิจการคลัง,,16
02034,องค์การสุรา กรมสรรพสามิต,,0
02035,โรงงานยาสูบ,,0
02036,โรงงานไพ่ กรมสรรพสามิต,,1
03001,สำนักงานปลัดกระทรวงการต่างประเทศ,,1
03002,สำนักปลัดกระทรวงการต่างประเทศ,,0
03003,สำนักเลขาธิการ ACMECS,,0
04001,กรมการท่องเที่ยว,,10
04002,กรมพลศึกษา,,9
04003,กองบัญชาการตำรวจท่องเที่ยว,,5
04004,การกีฬาแห่งประเทศไทย,,113
04005,การท่องเที่ยวแห่งประเทศไทย,['ททท.'],94
04006,คณะกรรมการนโยบายการท่องเที่ยวแห่งชาติ,,0
04007,มหาวิทยาลัยการกีฬาแห่งชาติ,,1
04008,สถาบันการพลศึกษา,,11
04009,สำนักงานปลัดกระทรวงการท่องเที่ยวและกีฬา,,89
04010,องค์การบริหารการพัฒนาพื้นที่พิเศษเพื่อการท่องเที่ยวอย่างยั่งยืน (องค์การมหาชน),,3
05001,กรมกิจการผู้สูงอายุ,,21
05002,กรมกิจการสตรีและสถาบันครอบครัว,,18
05003,กรมกิจการเด็กและเยาวชน,,18
05004,กรมพัฒนาสังคมและสวัสดิการ,,144
05005,กรมส่งเสริมและพัฒนาคุณภาพชีวิตคนพิการ,,10
05006,การเคหะแห่งชาติ,,30
05007,สถาบันพัฒนาองค์กรชุมชน,,19
05008,สถาบันพัฒนาองค์กรชุมชน (องค์การมหาชน),,1
05009,สำนักงานธนานุเคราะห์,,7
05010,สำนักงานปลัดกระทรวงการพัฒนาสังคมและความมั่นคงของมนุษย์,,2
05011,สำนักงานปลัดกระทรวงฯ,,103
05012,สำนักงานรัฐมนตรี,,5
06001,กรมวิทยาศาสตร์บริการ,['วศ.'],11
06002,จุฬาลงกรณ์มหาวิทยาลัย,,80
06003,มหาวิทยาลัยกาฬสินธุ์,,19
06004,มหาวิทยาลัยขอนแก่น,,35
06005,มหาวิทยาลัยทักษิณ,,33
06006,มหาวิทยาลัยธรรมศาสตร์,,53
06007,มหาวิทยาลัยนครพนม,,22
06008,มหาวิทยาลัยนราธิวาสราชนครินทร์,,20
06009,มหาวิทยาลัยนเรศวร,,52
06010,มหาวิทยาลัยบูรพา,,39
06011,มหาวิทยาลัยพะเยา,,19
06012,มหาวิทยาลัยมหาจุฬาลงกรณราชวิทยาลัย,,44
06013,มหาวิทยาลัยมหามกุฏราชวิทยาลัย,,1
06014,มหาวิทยาลัยมหามกุฏราชวิทยาลัย (มมร),,12
06015,มหาวิทยาลัยมหาสารคาม,,54
06016,มหาวิทยาลัยมหิดล,,41
06017,มหาวิทยาลัยราชภัฎนครปฐม,,16
06018,มหาวิทยาลัยราชภัฎพระนครศรีอยุธยา,,1
06019,มหาวิทยาลัยราชภัฏกาญจนบุรี,,15
06020,มหาวิทยาลัยราชภัฏกาฬสินธุ์,,0
06021,มหาวิทยาลัยราชภัฏกำแพงเพชร,,16
06022,มหาวิทยาลัยราชภัฏจันทรเกษม,,26
06023,มหาวิทยาลัยราชภัฏชัยภูมิ,,13
06024,มหาวิทยาลัยราชภัฏธนบุรี,,22
06025,มหาวิทยาลัยราชภัฏนครปฐม,,1
06026,มหาวิทยาลัยราชภัฏนครราชสีมา,,16
06027,มหาวิทยาลัยราชภัฏนครศรีธรรมราช,,21
06028,มหาวิทยาลัยราชภัฏนครสวรรค์,,11
06029,มหาวิทยาลัยราชภัฏบุรีรัมย์,,34
06030,มหาวิทยาลัยราชภัฏบ้านสมเด็จเจ้าพระยา,,26
06031,มหาวิทยาลัยราชภัฏพระนคร,,13
06032,มหาวิทยาลัยราชภัฏพระนครศรีอยุธยา,,14
06033,มหาวิทยาลัยราชภัฏพิบูลสงคราม,,15
06034,มหาวิทยาลัยราชภัฏภูเก็ต,,16
06035,มหาวิทยาลัยราชภัฏมหาสารคาม,,12
06036,มหาวิทยาลัยราชภัฏยะลา,,18
06037,มหาวิทยาลัยราชภัฏราชนครินทร์,,18
06038,มหาวิทยาลัยราชภัฏรำไพพรรณี,,22
06039,มหาวิทยาลัยราชภัฏร้อยเอ็ด,,14
06040,มหาวิทยาลัยราชภัฏลำปาง,,11
06041,มหาวิทยาลัยราชภัฏวไลยอลงกรณ์ ในพระบรมราชูปถัมภ์,,21
06042,มหาวิทยาลัยราชภัฏวไลยอลงกรณ์ ในพระบรมราชูปถัมภ์ จังหวัดปทุมธานี,,1
06043,มหาวิทยาลัยราชภัฏศรีสะเกษ,,8
06044,มหาวิทยาลัยราชภัฏสกลนคร,,14
06045,มหาวิทยาลัยราชภัฏสงขลา,,20
06046,มหาวิทยาลัยราชภัฏสวนสุนันทา,,26
06047,มหาวิทยาลัยราชภัฏสุราษฎร์ธานี,,16
06048,มหาวิทยาลัยราชภัฏสุรินทร์,,19
06049,มหาวิทยาลัยราชภัฏหมู่บ้านจอมบึง,,17
06050,มหาวิทยาลัยราชภัฏอุดรธานี,,16
06051,มหาวิทยาลัยราชภัฏอุตรดิตถ์,,28
06052,มหาวิทยาลัยราชภัฏอุบลราชธานี,,27
06053,มหาวิทยาลัยราชภัฏเชียงราย,,28
06054,มหาวิทยาลัยราชภัฏเชียงใหม่,,11
06055,มหาวิทยาลัยราชภัฏเทพสตรี,,25
06056,มหาวิทยาลัยราชภัฏเพชรบุรี,,17
06057,มหาวิทยาลัยราชภัฏเพชรบูรณ์,,12
06058,มหาวิทยาลัยราชภัฏเลย,,13
06059,มหาวิทยาลัยรามคำแหง,,74
06060,มหาวิทยาลัยวลัยลักษณ์,,21
06061,มหาวิทยาลัยศรีนครินทรวิโรฒ,,4
06062,มหาวิทยาลัยศิลปากร,,25
06063,มหาวิทยาลัยสงขลานครินทร์,,58
06064,มหาวิทยาลัยสวนดุสิต,,28
06065,มหาวิทยาลัยสุโขทัยธรรมาธิราช,,2
06066,มหาวิทยาลัยอุบลราชธานี,,19
06067,มหาวิทยาลัยเกษตรศาสตร์,,50
06068,มหาวิทยาลัยเชียงใหม่,,69
06069,มหาวิทยาลัยเทคโนโลยีพระจอมเกล้าธนบุรี,,20
06070,มหาวิทยาลัยเทคโนโลยีพระจอมเกล้าพระนครเหนือ,,2
06071,มหาวิทยาลัยเทคโนโลยีราชมงคลกรุงเทพ,,20
06072,มหาวิทยาลัยเทคโนโลยีราชมงคลตะวันออก,,33
06073,มหาวิทยาลัยเทคโนโลยีราชมงคลธัญบุรี,,34
06074,มหาวิทยาลัยเทคโนโลยีราชมงคลพระนคร,,30
06075,มหาวิทยาลัยเทคโนโลยีราชมงคลรัตนโกสินทร์,,21
06076,มหาวิทยาลัยเทคโนโลยีราชมงคลล้านนา,,18
06077,มหาวิทยาลัยเทคโนโลยีราชมงคลศรีวิชัย,,21
06078,มหาวิทยาลัยเทคโนโลยีราชมงคลสุวรรณภูมิ,,11
06079,มหาวิทยาลัยเทคโนโลยีราชมงคลอีสาน,,25
06080,มหาวิทยาลัยเทคโนโลยีสุรนารี,,11
06081,มหาวิทยาลัยแม่ฟ้าหลวง,,17
06082,มหาวิทยาลัยแม่โจ้,,22
06083,ศูนย์ความเป็นเลิศด้านชีววิทยาศาสตร์ (องค์การมหาชน),['ศลช.'],13
06084,สถาบันการพยาบาลศรีสวรินทิรา สภากาชาดไทย,,6
06085,สถาบันดนตรีกัลยาณิวัฒนา,,3
06086,สถาบันบัณฑิตพัฒนบริหารศาสตร์,,25
06087,สถาบันมาตรวิทยาแห่งชาติ,['มว.'],16
06088,สถาบันวิจัยดาราศาสตร์แห่งชาติ (องค์การมหาชน),['สดร.'],8
06089,สถาบันวิจัยวิทยาศาสตร์และเทคโนโลยีแห่งประเทศไทย,['วว.'],55
06090,สถาบันวิจัยแสงซินโครตรอน,,6
06091,สถาบันวิจัยแสงซินโครตรอน (องค์การมหาชน),['สซ.'],1
06092,สถาบันวิทยาลัยชุมชน,,6
06093,สถาบันสารสนเทศทรัพยากรน้ำ (องค์การมหาชน),['สสน.'],8
06094,สถาบันเทคโนโลยีจิตรลดา,,6
06095,สถาบันเทคโนโลยีนิวเคลียร์แห่งชาติ (องค์การมหาชน),['สทน.'],52
06096,สถาบันเทคโนโลยีปทุมวัน,,7
06097,สถาบันเทคโนโลยีพระจอมเกล้าเจ้าคุณทหารลาดกระบัง,,25
06098,สำนักงานการวิจัยแห่งชาติ,,12
06099,สำนักงานคณะกรรมการการอุดมศึกษา,['สกอ.'],19
06100,สำนักงานคณะกรรมการส่งเสริมวิทยาศาสตร์ วิจัยและนวัตกรรม,['สกสว.'],6
06101,สำนักงานนวัตกรรมแห่งชาติ,,0
06102,สำนักงานนวัตกรรมแห่งชาติ (องค์การมหาชน),['สนช.'],7
06103,สำนักงานปรมาณูเพื่อสันติ,['ปส.'],10
06104,สำนักงานปลัดกระทรวง,['สป.วท.'],20
06105,สำนักงานปลัดกระทรวงการอุดมศึกษา วิทยาศาสตร์ วิจัย และนวัตกรรม,,1
06106,สำนักงานพัฒนาวิทยาศาสตร์และเทคโนโลยีแห่งชาติ,['พว.'],8
06107,สำนักงานพัฒนาเทคโนโลยีอวกาศและภูมิสารสนเทศ (องค์การมหาชน),['สทอภ.'],21
06108,สำนักงานรัฐมนตรี,['สร.'],5
06109,สำนักงานสภานโยบายการอุดมศึกษา วิทยาศาสตร์ วิจัยและนวัตกรรมแห่งชาติ,['สอวช.'],18
06110,องค์การพิพิธภัณฑ์วิทยาศาสตร์แห่งชาติ,['อพ.'],10
07001,กรมการขนส่งทางบก,,99
07002,กรมการขนส่งทางราง,,8
07003,กรมการบินพลเรือน,,1
07004,กรมทางหลวง,,158
07005,กรมทางหลวงชนบท,,113
07006,กรมท่าอากาศยาน,,44
07007,กรมเจ้าท่า,,75
07008,การทางพิเศษแห่งประเทศไทย,,16
07009,การท่าเรือแห่งประเทศไทย,,24
07010,การรถไฟฟ้าขนส่งมวลชนแห่งประเทศไทย,,22
07011,การรถไฟแห่งประเทศไทย,,10
07012,บริษัท การบินไทย จำกัด (มหาชน),,15
07013,บริษัท ขนส่ง จำกัด,,34
07014,บริษัท ท่าอากาศยานไทย จำกัด (มหาชน),,11
07015,บริษัท รถไฟฟ้า ร.ฟ.ท. จำกัด,['รฟฟท.'],13
07016,บริษัท วิทยุการบินแห่งประเทศไทย จำกัด,,96
07017,บริษัท โรงแรมท่าอากาศยานสุวรรณภูมิ จำกัด,,0
07018,บริษัท ไทย-อะมาดิอุส เซาท์อีสต์ เอเชีย จำกัด,,0
07019,บริษัท ไทยสมายล์แอร์เวย์ จำกัด,,0
07020,สถาบันการบินพลเรือน,,1
07021,สำนักงานการบินพลเรือนแห่งประเทศไทย,,21
07022,สำนักงานนโยบายและแผนการขนส่งและจราจร,,13
07023,สำนักงานปลัดกระทรวงคมนาคม,,18
07024,สำนักงานรัฐมนตรี,,5
07025,องค์การขนส่งมวลชนกรุงเทพ,,26
08001,กรมอุตุนิยมวิทยา,,23
08002,กองบังคับการปราบปรามการกระทำความผิดเกี่ยวกับอาชญากรรมทางเทคโนโลยี,,6
08003,บริษัท กสท โทรคมนาคม จำกัด (มหาชน),,61
08004,บริษัท ทีโอที จำกัด (มหาชน),,13
08005,บริษัท โครงข่ายบรอดแบนด์แห่งชาติ จำกัด,,9
08006,บริษัท ไปรษณีย์ไทย จำกัด,,57
08007,สำนักงานคณะกรรมการคุ้มครองข้อมูลส่วนบุคคล,,1
08008,สำนักงานคณะกรรมการดิจิทัลเพื่อเศรษฐกิจและสังคมแห่งชาติ,,13
08009,สำนักงานปลัดกระทรวงดิจิทัลเพื่อเศรษฐกิจและสังคม,,3
08010,สำนักงานปลัดกระทรวงดิจิทัลเพื่อเศรษฐิจและสังคม,,14
08011,สำนักงานพัฒนาธุรกรรมทางอิเล็กทรอนิกส์,,14
08012,สำนักงานรัฐบาลอิเล็กทรอนิกส์ (องค์การมหาชน),,1
08013,สำนักงานสถิติแห่งชาติ,,90
08014,สำนักงานส่งเสริมเศรษฐกิจดิจิทัล,,20
09001,กรมควบคุมมลพิษ,,10
09002,กรมทรัพยากรทางทะเลและชายฝั่ง,,33
09003,กรมทรัพยากรธรณี,,19
09004,กรมทรัพยากรน้ำ,,28
09005,กรมทรัพยากรน้ำบาดาล,,30
09006,กรมป่าไม้,,218
09007,กรมส่งเสริมคุณภาพสิ่งแวดล้อม,,14
09008,กรมอุทยานแห่งชาติ สัตว์ป่า และพันธุ์พืช,,445
09009,กรมอุทยานแห่งชาติ สัตว์ป่า และพันธ์พืช,,2
09010,สำนักงานนโยบายและแผนทรัพยากรธรรมชาติและสิ่งแวดล้อม,,16
09011,สำนักงานปลัดกระทรวงทรัพยากรธรรมชาติและสิ่งแวดล้อม,,109
09012,สำนักงานพัฒนาเศรษฐกิจจากฐานชีวภาพ,,1
09013,สำนักงานพัฒนาเศรษฐกิจจากฐานชีวภาพ (องค์การมหาชน),,1
09014,องค์การจัดการน้ำเสีย,,24
09015,องค์การบริหารจัดการก๊าซเรือนกระจก,,2
09016,องค์การบริหารจัดการก๊าซเรือนกระจก (องค์การมหาชน),,1
09017,องค์การสวนพฤกษศาสตร์,,6
09018,องค์การสวนสัตว์,,23
