id,official_name,alias_name,total_leaf_node
07006032,ท่าอากาศยานหัวหิน,,0
07006033,ท่าอากาศยานอุดรธานี,,0
07006034,ท่าอากาศยานอุบลราชธานี,,0
07006035,ท่าอากาศยานเบตง,,0
07006036,ท่าอากาศยานเพชรบูรณ์,,0
07006037,ท่าอากาศยานเลย,,0
07006038,ท่าอากาศยานแพร่,,0
07006039,ท่าอากาศยานแม่สอด,,0
07006040,ท่าอากาศยานแม่สะเรียง,,0
07006041,ท่าอากาศยานแม่ฮ่องสอน,,0
07006042,บัญชีผู้ใช้สำหรับพ.ร.ก.เงินกู้ กรมท่าอากาศยาน,,0
07006043,ศูนย์เทคโนโลยีสารสนเทศ,,0
07006044,สำนักงานเลขานุการกรม,,0
07007001,กรมเจ้าท่า,,0
07007002,กลุ่มตรวจสอบภายใน,,0
07007003,กลุ่มพัฒนาระบบบริหาร,,0
07007004,กองกำกับการพาณิชยนาวี,,0
07007005,กองคลัง,,0
07007006,กองมาตรฐานคนประจำเรือ,,0
07007007,กองวิศวกรรม,,0
07007008,กองสำรวจและแผนที่,,0
07007009,กองส่งเสริมการพาณิชยนาวี,,0
07007010,บัญชีผู้ใช้สำหรับพ.ร.ก.เงินกู้ กรมเจ้าท่า,,0
07007011,ศูนย์ฝึกพาณิชย์นาวี,,0
07007012,สำนักกฎหมาย,,0
07007013,สำนักความปลอดภัยและสิ่งแวดล้อมทางน้ำ,,0
07007014,สำนักงานพัฒนาและบำรุงรักษาทางน้ำที่ 1,,0
07007015,สำนักงานพัฒนาและบำรุงรักษาทางน้ำที่ 2,,0
07007016,สำนักงานพัฒนาและบำรุงรักษาทางน้ำที่ 3,,0
07007017,สำนักงานพัฒนาและบำรุงรักษาทางน้ำที่ 4,,0
07007018,สำนักงานพัฒนาและบำรุงรักษาทางน้ำที่ 5,,0
07007019,สำนักงานพัฒนาและบำรุงรักษาทางน้ำที่ 6,,0
07007020,สำนักงานพัฒนาและบำรุงรักษาทางน้ำที่ 7,,0
07007021,สำนักงานพัฒนาและบำรุงรักษาทางน้ำที่ 8,,0
07007022,สำนักงานเจ้าท่าภูมิภาคที่ 1,,0
07007023,สำนักงานเจ้าท่าภูมิภาคที่ 2,,0
07007024,สำนักงานเจ้าท่าภูมิภาคที่ 3,,0
07007025,สำนักงานเจ้าท่าภูมิภาคที่ 4,,0
07007026,สำนักงานเจ้าท่าภูมิภาคที่ 5,,0
07007027,สำนักงานเจ้าท่าภูมิภาคที่ 6,,0
07007028,สำนักงานเจ้าท่าภูมิภาคที่ 7,,0
07007029,สำนักงานเจ้าท่าภูมิภาคสาขากระบี่,,0
07007030,สำนักงานเจ้าท่าภูมิภาคสาขากาญจนบุรี,,0
07007031,สำนักงานเจ้าท่าภูมิภาคสาขาขอนแก่น,,0
07007032,สำนักงานเจ้าท่าภูมิภาคสาขาจันทบุรี,,0
07007033,สำนักงานเจ้าท่าภูมิภาคสาขาฉะเชิงเทรา,,0
07007034,สำนักงานเจ้าท่าภูมิภาคสาขาชลบุรี,,0
07007035,สำนักงานเจ้าท่าภูมิภาคสาขาชุมพร,,0
07007036,สำนักงานเจ้าท่าภูมิภาคสาขาตรัง,,0
07007037,สำนักงานเจ้าท่าภูมิภาคสาขาตราด,,0
07007038,สำนักงานเจ้าท่าภูมิภาคสาขานครปฐม,,0
07007039,สำนักงานเจ้าท่าภูมิภาคสาขานครพนม,,0
07007040,สำนักงานเจ้าท่าภูมิภาคสาขานครราชสีมา,,0
07007041,สำนักงานเจ้าท่าภูมิภาคสาขานครศรีธรรมราช,,0
07007042,สำนักงานเจ้าท่าภูมิภาคสาขานครสวรรค์,,0
07007043,สำนักงานเจ้าท่าภูมิภาคสาขานนทบุรี,,0
07007044,สำนักงานเจ้าท่าภูมิภาคสาขานราธิวาส,,0
07007045,สำนักงานเจ้าท่าภูมิภาคสาขาประจวบคีรีขันธ์,,0
07007046,สำนักงานเจ้าท่าภูมิภาคสาขาปัตตานี,,0
07007047,สำนักงานเจ้าท่าภูมิภาคสาขาพระนครศรีอยุธยา,,0
07007048,สำนักงานเจ้าท่าภูมิภาคสาขาพังงา,,0
07007049,สำนักงานเจ้าท่าภูมิภาคสาขาพัทยา,,0
07007050,สำนักงานเจ้าท่าภูมิภาคสาขาพิษณุโลก,,0
07007051,สำนักงานเจ้าท่าภูมิภาคสาขาภูเก็ต,,0
07007052,สำนักงานเจ้าท่าภูมิภาคสาขาระนอง,,0
07007053,สำนักงานเจ้าท่าภูมิภาคสาขาระยอง,,0
07007054,สำนักงานเจ้าท่าภูมิภาคสาขาลพบุรี,,0
07007055,สำนักงานเจ้าท่าภูมิภาคสาขาสงขลา,,0
07007056,สำนักงานเจ้าท่าภูมิภาคสาขาสตูล,,0
07007057,สำนักงานเจ้าท่าภูมิภาคสาขาสมุทรปราการ,,0
07007058,สำนักงานเจ้าท่าภูมิภาคสาขาสมุทรสงคราม,,0
07007059,สำนักงานเจ้าท่าภูมิภาคสาขาสมุทรสาคร,,0
07007060,สำนักงานเจ้าท่าภูมิภาคสาขาสุพรรณบุรี,,0
07007061,สำนักงานเจ้าท่าภูมิภาคสาขาสุราษฎร์ธานี,,0
07007062,สำนักงานเจ้าท่าภูมิภาคสาขาหนองคาย,,0
07007063,สำนักงานเจ้าท่าภูมิภาคสาขาอุบลราชธานี,,0
07007064,สำนักงานเจ้าท่าภูมิภาคสาขาเกาะพะงัน,,0
07007065,สำนักงานเจ้าท่าภูมิภาคสาขาเกาะสมุย,,0
07007066,สำนักงานเจ้าท่าภูมิภาคสาขาเชียงราย,,0
07007067,สำนักงานเจ้าท่าภูมิภาคสาขาเชียงใหม่,,0
07007068,สำนักงานเจ้าท่าภูมิภาคสาขาเพชรบุรี,,0
07007069,สำนักงานเจ้าท่าภูมิภาคสาขาแพร่,,0
07007070,สำนักงานเลขานุการกรม,,0
07007071,สำนักนำร่อง,,0
07007072,สำนักพัฒนาและบำรุงรักษาทางน้ำ,,0
07007073,สำนักมาตรฐานทะเบียนเรือ,,0
07007074,สำนักมาตรฐานเรือ,,0
07007075,สำนักแผนงาน,,0
07008001,กองบริหารความเสี่ยงและควบคุมภายใน,,0
07008002,กองวางแผนปฏิบัติการ,,0
07008003,กองวิจัยและพัฒนา,,0
07008004,บัญชีผู้ใช้สำหรับพ.ร.ก.เงินกู้ การทางพิเศษแห่งประเทศไทย,,0
07008005,ฝ่ายกฎหมาย,,0
07008006,ฝ่ายกรรมสิทธิ์ที่ดิน,,0
07008007,ฝ่ายการเงินและบัญชี,,0
07008008,ฝ่ายก่อสร้างทางพิเศษ,,0
07008009,ฝ่ายควบคุมการจราจร,,0
07008010,ฝ่ายจัดเก็บค่าผ่านทาง,,0
07008011,ฝ่ายนโยบายและแผน,,0
07008012,ฝ่ายบริหารทั่วไป,,0
07008013,ฝ่ายบำรุงรักษา,,0
07008014,ฝ่ายสารสนเทศ,,0
07008015,สำนักตรวจสอบภายใน,,0
07008016,สำนักผู้ว่าการ,,0
07009001,ท่าเรือกรุงเทพ,,0
07009002,ท่าเรือแหลมฉบัง,,0
07009003,บัญชีผู้ใช้สำหรับพ.ร.ก.เงินกู้ การท่าเรือแห่งประเทศไทย,,0
07009004,ฝ่ายกลยุทธ์องค์กร,,0
07009005,ฝ่ายการช่าง,,0
07009006,ฝ่ายการร่องน้ำ,,0
07009007,ฝ่ายการเงินและบัญชี,,0
07009008,ฝ่ายตรวจสอบ,,0
07009009,ฝ่ายบริการท่าและเครื่องมือทุ่นแรง,,0
07009010,ฝ่ายบริหารงานสนับสนุน,,0
07009011,ฝ่ายบริหารทรัพยากรบุคคล,,0
07009012,ฝ่ายปฏิบัติการเรือและสินค้า,,0
07009013,ฝ่ายพัฒนาธุรกิจและการตลาด,,0
07009014,ฝ่ายอำนวยการ,,0
07009015,ฝ่ายเทคโนโลยีสารสนเทศ,,0
07009016,สำนักท่าเรือภูมิภาค,,0
07009017,สำนักบรรษัทภิบาล (กองกำกับดูแลองค์กร),,0
07009018,สำนักบริหารการเงิน,,0
07009019,สำนักบริหารความเสี่ยงและควบคุมภายใน,,0
07009020,สำนักบริหารงานสนับสนุน,,0
07009021,สำนักบัญชี,,0
07009022,สำนักปฏิบัติการ,,0
07009023,สำนักเลขานุการคณะกรรมการการท่าเรือแห่งประเทศไทย,,0
07009024,สำนักแพทย์และอนามัย,,0
07010001,บัญชีผู้ใช้สำหรับพ.ร.ก.เงินกู้ การรถไฟฟ้าขนส่งมวลชนแห่งประเทศไทย,,0
07010002,ฝ่ายกรรมสิทธิ์ที่ดิน,,0
07010003,ฝ่ายจัดซื้อและบริการ,,0
07010004,ฝ่ายทรัพยากรบุคคล,,0
07010005,ฝ่ายธุรกิจบัตรโดยสาร,,0
07010006,ฝ่ายนโยบายและยุทธศาสตร์,,0
07010007,ฝ่ายบริหารงานก่อสร้าง 1,,0
07010008,ฝ่ายบริหารงานก่อสร้าง 2,,0
07010009,ฝ่ายบัญชีและการเงิน,,0
07010010,ฝ่ายปฏิบัติการ,,0
07010011,ฝ่ายพัฒนาธุรกิจ,,0
07010012,ฝ่ายพัฒนาและบริหารพื้นที่,,0
07010013,ฝ่ายพัฒนาโครงการรถไฟฟ้า,,0
07010014,ฝ่ายระบบรถไฟฟ้า,,0
07010015,ฝ่ายรักษาความปลอดภัยและกู้ภัย,,0
07010016,ฝ่ายวิศวกรรมและสถาปัตยกรรม,,0
07010017,ฝ่ายเทคโนโลยีสารสนเทศ,,0
07010018,สำนักกฎหมาย,,0
07010019,สำนักงานความปลอดภัย อาชีวอนามัย และสภาพแวดล้อมในการทำงาน,,0
07010020,สำนักตรวจสอบ,,0
07010021,สำนักสื่อสารองค์กร,,0
07010022,สำนักหน่วยธุรกิจรถไฟฟ้า,,0
07011001,บัญชีผู้ใช้สำหรับพ.ร.ก.เงินกู้ การรถไฟแห่งประเทศไทย,,0
07011002,ฝ่ายการช่างกล,,0
07011003,ฝ่ายการช่างโยธา,,0
07011004,ฝ่ายบริการสินค้า,,0
07011005,ฝ่ายบริการโดยสาร,,0
07011006,ฝ่ายบริหารทรัพย์สิน,,0
07011007,ฝ่ายปฏิบัติการเดินรถ,,0
07011008,ฝ่ายอาณัติสัญญาณและโทรคมนาคม,,0
07011009,ฝ่ายโครงการพิเศษและก่อสร้าง,,0
07011010,สำนักงานนโยบายแผนวิจัยและพัฒนา,,0
07012001,บัญชีผู้ใช้สำหรับพ.ร.ก.เงินกู้ บริษัท การบินไทย จำกัด (มหาชน),,0
07012002,ฝ่ายการพาณิชย์สินค้าและไปรษณียภัณฑ์,,0
07012003,ฝ่ายครัวการบิน,,0
07012004,ฝ่ายช่าง,,0
07012005,ฝ่ายบริการลูกค้าภาคพื้น,,0
07012006,ฝ่ายบริการอุปกรณ์ภาคพื้น,,0
07012007,ฝ่ายบริหารกลยุทธ์,,0
07012008,สายกลยุทธ์องค์กรและพัฒนาอย่างยั่งยืน,,0
07012009,สายการพาณิชย์,,0
07012010,สายการเงินและการบัญชี,,0
07012011,สายทรัพยากรบุคคล,,0
07012012,สายบริหารงานกฎหมายและบริหารทั่วไป,,0
07012013,สายปฏิบัติการ,,0
07012014,สำนักงานกรรมการผู้อำนวยการใหญ่,,0
07012015,หน่วยธุรกิจบริการการบิน,,0
07013001,กองกฏหมาย,,0
07013002,กองการแพทย์,,0
07013003,กองกิจการสถานีขนส่ง,,0
07013004,กองกิจการเดินรถ,,0
07013005,กองคุ้มครองผู้โดยสาร,,0
07013006,กองงบประมาณ,,0
07013007,กองจัดการเดินรถ,,0
07013008,กองซ่อมบำรุง,,0
07013009,กองตรวจสภาพรถ,,0
07013010,กองบริหารกลาง,,0
07013011,กองบริหารความเสี่ยงและความปลอดภัยอาชีวอนามัย,,0
07013012,กองบริหารทรัพยากรบุคคล,,0
07013013,กองบัญชีและการเงิน,,0
07013014,กองปฏิบัติการเดินรถภาคตะวันออกเฉียงเหนือและภาคตะวันออก,,0
07013015,กองปฏิบัติการเดินรถภาคเหนือ,,0
07013016,กองปฏิบัติการเดินรถภาคใต้,,0
07013017,กองพัฒนาทรัพยากรบุคคล,,0
07013018,กองพัสดุ,,0
07013019,กองระบบและประมวลผลบัญชี,,0
07013020,กองวางแผนกลยุทธ์,,0
07013021,กองสนับสนุนการเดินรถ,,0
07013022,กองสนับสนุนซ่อมบำรุง,,0
07013023,กองสื่อสารองค์กรและการตลาด,,0
07013024,กองส่งเสริมธุรกิจเดินรถ,,0
07013025,กองเทคโนโลยีสารสนเทศ,,0
07013026,งานตรวจการ,,0
07013027,บัญชีผู้ใช้สำหรับพ.ร.ก.เงินกู้ บริษัท ขนส่ง จำกัด,,0
07013028,ฝ่ายธุรกิจเดินรถ,,0
07013029,ฝ่ายบริหาร,,0
07013030,ฝ่ายบริหารการเดินรถ,,0
07013031,ฝ่ายพัฒนาองค์กร,,0
07013032,สำนักซ่อมบำรุงและตรวจสภาพรถ,,0
07013033,สำนักตรวจสอบภายใน,,0
07013034,สำนักอำนวยการ,,0
07014001,ท่าอากาศยานดอนเมือง,,0
07014002,ท่าอากาศยานภูเก็ต,,0
07014003,ท่าอากาศยานสุวรรณภูมิ,,0
07014004,ท่าอากาศยานหาดใหญ่,,0
07014005,ท่าอากาศยานเชียงใหม่,,0
07014006,ท่าอากาศยานแม่ฟ้าหลวง เชียงราย,,0
07014007,บัญชีผู้ใช้สำหรับพ.ร.ก.เงินกู้ บริษัท ท่าอากาศยานไทย จำกัด (มหาชน),,0
07014008,ฝ่ายกลยุทธ์องค์กร,,0
07014009,ฝ่ายแผนพัฒนาท่าอากาศยาน,,0
07014010,สำนักงานบริหารโครงการก่อสร้างท่าอากาศยานสุวรรณภูมิ,,0
07014011,สำนักงานใหญ่,,0
07015001,ฝ่ายควบคุมการเดินรถ,,0
07015002,ฝ่ายตรวจสอบภายใน,,0
07015003,ฝ่ายทรัพยากรบุคคลและอำนวยการ,,0
07015004,ฝ่ายธุรกิจองค์กร,,0
07015005,ฝ่ายบัญชีและการเงิน,,0
07015006,ฝ่ายปฏิบัติการสถานีรถไฟฟ้า,,0
07015007,ฝ่ายระบบรถไฟฟ้าและระบบอุปกรณ์รถไฟฟ้า,,0
07015008,ฝ่ายวางแผนและกลยุทธ์องค์กร,,0
07015009,ฝ่ายสำนักกรรมการผู้อำนวยการใหญ่,,0
07015010,ฝ่ายโครงสร้างพื้นฐาน,,0
07015011,ส่วนความปลอดภัยและควบคุมคุณภาพ,,0
07015012,ส่วนจัดซื้อ,,0
07015013,ส่วนวิศวกรรมซ่อมบำรุง,,0
07016001,กรรมการผู้อำนวยการใหญ่,,0
07016002,กลุ่มงานควบคุมจราจรทางอากาศเขตประชิดสนามบินภูมิภาค,,0
07016003,กลุ่มงานควบคุมจราจรทางอากาศเขตสนามบินกรุงเทพ,,0
07016004,กลุ่มงานควบคุมจราจรทางอากาศเส้นทางบินกรุงเทพ,,0
07016005,กลุ่มงานบริหารความเสี่ยงและบริหารผลการดำเนินงาน,,0
07016006,กลุ่มงานพัฒนาองค์กร,,0
07016007,กลุ่มงานวิเคราะห์นโยบายและวางแผนกลยุทธ์,,0
07016008,กลุ่มงานวิเคราะห์โครงการ,,0
07016009,กลุ่มงานสนับสนุนการควบคุมจราจรทางอากาศเขตประชิดสนามบินภูมิภาค,,0
07016010,กลุ่มงานสนับสนุนการควบคุมจราจรทางอากาศเขตสนามบินกรุงเทพ,,0
07016011,กลุ่มงานสนับสนุนการควบคุมจราจรทางอากาศเส้นทางบินกรุงเทพ,,0
07016012,กองกลยุทธ์และพัฒนาผลิตภัณฑ์ธุรกิจ,,0
07016013,กองการผลิตและซ่อมบำรุง,,0
07016014,กองการพัสดุ,,0
07016015,กองการเงิน,,0
07016016,กองงบประมาณ,,0
07016017,กองธุรกิจต่างประเทศ,,0
07016018,กองธุรกิจในประเทศ,,0
07016019,กองนิติการ,,0
07016020,กองบริการ,,0
07016021,กองบริการข่ายสื่อสารสายการบิน,,0
07016022,กองบริการระบบวิทยุสื่อสาร,,0
07016023,กองบริการไฟฟ้าและโทรศัพท์,,0
07016024,กองบริหารความปลอดภัย,,0
07016025,กองบริหารทรัพยากรบุคคล,,0
07016026,กองบริหารระบบเทคโนโลยีสารสนเทศ,,0
07016027,กองบัญชีและรายได้,,0
07016028,กองปฏิบัติการบิน,,0
07016029,กองปรับมาตรฐานเครื่องวัด,,0
07016030,กองพัฒนาทรัพยากรบุคคลด้านปฏิบัติการ,,0
07016031,กองพัฒนาทรัพยากรบุคคลด้านวิศวกรรม,,0
07016032,กองพัฒนาระบบเทคโนโลยีสารสนเทศ,,0
07016033,กองพัฒนาและบริหารการจัดการเรียนรู้,,0
07016034,กองมาตรฐานการบริการ,,0
07016035,กองรักษาความปลอดภัย,,0
07016036,กองวิจัยและพัฒนาวิศวกรรมจราจรทางอากาศ,,0
07016037,กองวิศวกรรมระบบข้อมูลการบิน,,0
07016038,กองวิศวกรรมระบบติดตามอากาศยาน,,0
07016039,กองวิศวกรรมระบบสื่อสารการเดินอากาศ,,0
07016040,กองวิศวกรรมระบบเครื่องช่วยการเดินอากาศ,,0
07016041,กองวิศวกรรมอากาศยาน,,0
07016042,กองวิสาหกิจสัมพันธ์,,0
07016043,กองสนับสนุนธุรกิจ,,0
07016044,กองสวัสดิการ,,0
07016045,กองสื่อสารองค์กร,,0
07016046,กองออกแบบวิธีปฏิบัติการบินและพัฒนาห้วงอากาศ,,0
07016047,กองออกแบบและติดตั้งระบบวิศวกรรม,,0
07016048,กองอาคารและสถานที่,,0
07016049,กองเลขานุการและสารบรรณ,,0
07016050,กองแบบแผนและควบคุมการก่อสร้าง,,0
07016051,บัญชีผู้ใช้สำหรับพ.ร.ก.เงินกู้ บริษัท วิทยุการบินแห่งประเทศไทย จำกัด,,0
07016052,ผู้อำนวยการใหญ่ (การเงิน),,0
07016053,ผู้อำนวยการใหญ่ (ทรัพยากรบุคคล),,0
07016054,ผู้อำนวยการใหญ่ (บริหารจราจรทางอากาศ),,0
07016055,ผู้อำนวยการใหญ่ (ภูมิภาคและศูนย์ประกอบการ),,0
07016056,ผู้อำนวยการใหญ่ (วิศวกรรมจราจรทางอากาศ),,0
07016057,ผู้อำนวยการใหญ่ (สำนักกรรมการผู้อำนวยการใหญ่),,0
07016058,ผู้อำนวยการใหญ่ (สำนักตรวจสอบภายใน),,0
