id,official_name,alias_name,total_leaf_node
22003015,กองตลาดยุโรปฯ,,0
22003016,กองตลาดอาเซียน เอเชียใต้ฯ,,0
22003017,กองตลาดอเมริกา,,0
22003018,กองตลาดเอเชียตะวันออก,,0
22003019,กองนวัตกรรมอุตสาหกรรมท่องเที่ยว,,0
22003020,กองบริหารความยั่งยืน,,0
22003021,กองบริหารความเสี่ยง,,0
22003022,กองบริหารจัดซื้อจัดจ้าง,,0
22003023,กองประชาสัมพันธ์ต่างประเทศ,,0
22003024,กองประชาสัมพันธ์ในประเทศ,,0
22003025,กองพัฒนาบุคลากร,,0
22003026,กองพัฒนาระบบ,,0
22003027,กองรายได้,,0
22003028,กองวารสาร,,0
22003029,กองวิจัยการตลาด / กลุ่มฐานข้อมูลการตลาด,,0
22003030,กองสร้างสรรค์กิจกรรม,,0
22003031,กองสวัสดิการและบุคลากรสัมพันธ์,,0
22003032,กองส่งเสริมบริการท่องเที่ยว,,0
22003033,กองส่งเสริมสินค้าการท่องเที่ยว,,0
22003034,กองส่งเสริมแหล่งท่องเที่ยว,,0
22003035,กองอาคารสถานที่,,0
22003036,กองเผยแพร่ความรู้ด้านการท่องเที่ยว,,0
22003037,กองเผยแพร่โฆษณาต่างประเทศ,,0
22003038,กองเผยแพร่โฆษณาในประเทศ,,0
22003039,กองแผนนโยบาย,,0
22003040,การท่องเที่ยวแห่งประเทศไทย สำนักงานกระบี่,,0
22003041,การท่องเที่ยวแห่งประเทศไทย สำนักงานกรุงเทพมหานคร,,0
22003042,การท่องเที่ยวแห่งประเทศไทย สำนักงานกาญจนบุรี,,0
22003043,การท่องเที่ยวแห่งประเทศไทย สำนักงานขอนแก่น,,0
22003044,การท่องเที่ยวแห่งประเทศไทย สำนักงานจันทบุรี,,0
22003045,การท่องเที่ยวแห่งประเทศไทย สำนักงานฉะเชิงเทรา,,0
22003046,การท่องเที่ยวแห่งประเทศไทย สำนักงานชุมพร,,0
22003047,การท่องเที่ยวแห่งประเทศไทย สำนักงานตรัง,,0
22003048,การท่องเที่ยวแห่งประเทศไทย สำนักงานตราด,,0
22003049,การท่องเที่ยวแห่งประเทศไทย สำนักงานตาก,,0
22003050,การท่องเที่ยวแห่งประเทศไทย สำนักงานนครนายก,,0
22003051,การท่องเที่ยวแห่งประเทศไทย สำนักงานนครพนม,,0
22003052,การท่องเที่ยวแห่งประเทศไทย สำนักงานนครราชสีมา,,0
22003053,การท่องเที่ยวแห่งประเทศไทย สำนักงานนครศรีธรรมราช,,0
22003054,การท่องเที่ยวแห่งประเทศไทย สำนักงานนครสวรรค์,,0
22003055,การท่องเที่ยวแห่งประเทศไทย สำนักงานนราธิวาส,,0
22003056,การท่องเที่ยวแห่งประเทศไทย สำนักงานน่าน,,0
22003057,การท่องเที่ยวแห่งประเทศไทย สำนักงานบุรีรัมย์,,0
22003058,การท่องเที่ยวแห่งประเทศไทย สำนักงานประจวบคีรีขันธ์,,0
22003059,การท่องเที่ยวแห่งประเทศไทย สำนักงานพระนครศรีอยุธยา,,0
22003060,การท่องเที่ยวแห่งประเทศไทย สำนักงานพังงา,,0
22003061,การท่องเที่ยวแห่งประเทศไทย สำนักงานพัทยา,,0
22003062,การท่องเที่ยวแห่งประเทศไทย สำนักงานพิษณุโลก,,0
22003063,การท่องเที่ยวแห่งประเทศไทย สำนักงานภูเก็ต,,0
22003064,การท่องเที่ยวแห่งประเทศไทย สำนักงานระยอง,,0
22003065,การท่องเที่ยวแห่งประเทศไทย สำนักงานราชบุรี,,0
22003066,การท่องเที่ยวแห่งประเทศไทย สำนักงานลพบุรี,,0
22003067,การท่องเที่ยวแห่งประเทศไทย สำนักงานลำปาง,,0
22003068,การท่องเที่ยวแห่งประเทศไทย สำนักงานสตูล,,0
22003069,การท่องเที่ยวแห่งประเทศไทย สำนักงานสมุทรสงคราม,,0
22003070,การท่องเที่ยวแห่งประเทศไทย สำนักงานสุพรรณบุรี,,0
22003071,การท่องเที่ยวแห่งประเทศไทย สำนักงานสุราษฎร์ธานี,,0
22003072,การท่องเที่ยวแห่งประเทศไทย สำนักงานสุรินทร์,,0
22003073,การท่องเที่ยวแห่งประเทศไทย สำนักงานสุโขทัย,,0
22003074,การท่องเที่ยวแห่งประเทศไทย สำนักงานหาดใหญ่,,0
22003075,การท่องเที่ยวแห่งประเทศไทย สำนักงานอุดรธานี,,0
22003076,การท่องเที่ยวแห่งประเทศไทย สำนักงานอุทัยธานี,,0
22003077,การท่องเที่ยวแห่งประเทศไทย สำนักงานอุบลราชธานี,,0
22003078,การท่องเที่ยวแห่งประเทศไทย สำนักงานเกาะสมุย,,0
22003079,การท่องเที่ยวแห่งประเทศไทย สำนักงานเชียงราย,,0
22003080,การท่องเที่ยวแห่งประเทศไทย สำนักงานเชียงใหม่,,0
22003081,การท่องเที่ยวแห่งประเทศไทย สำนักงานเพชรบุรี,,0
22003082,การท่องเที่ยวแห่งประเทศไทย สำนักงานเลย,,0
22003083,การท่องเที่ยวแห่งประเทศไทย สำนักงานแพร่,,0
22003084,การท่องเที่ยวแห่งประเทศไทย สำนักงานแม่ฮ่องสอน,,0
22003085,บัญชีผู้ใช้สำหรับพ.ร.ก.เงินกู้ การท่องเที่ยวแห่งประเทศไทย,,0
22003086,ฝ่ายการเงิน,,0
22003087,ฝ่ายกิจกรรม,,0
22003088,ฝ่ายติดตามและบริหารความเสี่ยง,['กตป.'],0
22003089,ฝ่ายทรัพยากรบุคคล,,0
22003090,ฝ่ายบริการการตลาด,['กขส.'],0
22003091,ฝ่ายบัญชีและงบประมาณ,,0
22003092,ฝ่ายลงทุนธุรกิจท่องเที่ยว,,0
22003093,สำนักตรวจสอบภายใน,,0
22003094,สำนักผู้ว่าการ,,0
22004001,ท่าเรือกรุงเทพ,,0
22004002,ท่าเรือแหลมฉบัง,,0
22004003,บัญชีผู้ใช้สำหรับพ.ร.ก.เงินกู้ การท่าเรือแห่งประเทศไทย,,0
22004004,ฝ่ายกลยุทธ์องค์กร,,0
22004005,ฝ่ายการช่าง,,0
22004006,ฝ่ายการร่องน้ำ,,0
22004007,ฝ่ายการเงินและบัญชี,,0
22004008,ฝ่ายตรวจสอบ,,0
22004009,ฝ่ายบริการท่าและเครื่องมือทุ่นแรง,,0
22004010,ฝ่ายบริหารงานสนับสนุน,,0
22004011,ฝ่ายบริหารทรัพยากรบุคคล,,0
22004012,ฝ่ายปฏิบัติการเรือและสินค้า,,0
22004013,ฝ่ายพัฒนาธุรกิจและการตลาด,,0
22004014,ฝ่ายอำนวยการ,,0
22004015,ฝ่ายเทคโนโลยีสารสนเทศ,,0
22004016,สำนักท่าเรือภูมิภาค,,0
22004017,สำนักบรรษัทภิบาล (กองกำกับดูแลองค์กร),,0
22004018,สำนักบริหารการเงิน,,0
22004019,สำนักบริหารความเสี่ยงและควบคุมภายใน,,0
22004020,สำนักบริหารงานสนับสนุน,,0
22004021,สำนักบัญชี,,0
22004022,สำนักปฏิบัติการ,,0
22004023,สำนักเลขานุการคณะกรรมการการท่าเรือแห่งประเทศไทย,,0
22004024,สำนักแพทย์และอนามัย,,0
22005001,กองกฎหมายและระเบียบ,,0
22005002,กองกลาง,,0
22005003,กองการตลาดและลูกค้าสัมพันธ์,,0
22005004,กองการประชุม,,0
22005005,กองการเงิน,,0
22005006,กองกำกับการปฏิบัติการ,,0
22005007,กองคดี,,0
22005008,กองความปลอดภัยและอาชีวอนามัย,,0
22005009,กองตรวจสอบ 1,,0
22005010,กองตรวจสอบ 2,,0
22005011,กองนวัตกรรมและพัฒนาองค์กร,,0
22005012,กองนิติกรรมและกรรมสิทธิ์ที่ดิน,,0
22005013,กองนโยบายและแผน,,0
22005014,กองบริหารความเสี่ยงและควบคุมภายใน,,0
22005015,กองบริหารงานชุมชนสัมพันธ์,,0
22005016,กองบริหารทรัพยากรบุคคล,,0
22005017,กองบริหารเมืองอุตสาหกรรมเชิงนิเวศ,,0
22005018,กองบัญชีการเงิน,,0
22005019,กองบัญชีบริหารและงบประมาณ,,0
22005020,กองปฏิบัติการเทคโนโลยีสารสนเทศ,,0
22005021,กองประชาสัมพันธ์,,0
22005022,กองพัฒนาชุมชนสัมพันธ์,,0
22005023,กองพัฒนาทรัพยากรบุคคล,,0
22005024,กองพัฒนาท่าเรือ,,0
22005025,กองพัฒนาธุรกิจ,,0
22005026,กองพัฒนาระบบงานสารสนเทศ,,0
22005027,กองพัฒนาเมืองอุตสาหกรรมเชิงนิเวศ,,0
22005028,กองพัสดุ,,0
22005029,กองวิศวกรรม,,0
22005030,กองสนับสนุนการปฏิบัติการ,,0
22005031,กองสิทธิประโยชน์,,0
22005032,กองสิ่งแวดล้อมและพลังงาน,,0
22005033,กองอนุญาตก่อสร้าง,,0
22005034,กองอนุญาตผู้ประกอบกิจการ,,0
22005035,กองอนุญาตผู้ร่วมดำเนินงานและกำกับดูแลโครงการนิคมอุตสาหกรรม,,0
22005036,กองอำนวยการปฏิบัติการ 1,,0
22005037,กองอำนวยการปฏิบัติการ 2,,0
22005038,กองอำนวยการปฏิบัติการ 3,,0
22005039,บัญชีผู้ใช้สำหรับพ.ร.ก.เงินกู้ การนิคมอุตสาหกรรมแห่งประเทศไทย,,0
22005040,ฝ่ายกฎหมาย,,0
22005041,ฝ่ายการตลาด,,0
22005042,ฝ่ายการเงินและบัญชี,,0
22005043,ฝ่ายชุมชนสัมพันธ์,,0
22005044,ฝ่ายตรวจสอบภายใน,,0
22005045,ฝ่ายทรัพยากรบุคคล,,0
22005046,ฝ่ายบริการผู้ประกอบกิจการ,,0
22005047,ฝ่ายบริหาร,,0
22005048,ฝ่ายพัฒนา,,0
22005049,ฝ่ายพัฒนาเมืองอุตสาหกรรมเชิงนิเวศ,,0
22005050,ฝ่ายยุทธศาสตร์,,0
22005051,ฝ่ายสิ่งแวดล้อม,,0
22005052,ฝ่ายอำนวยการปฏิบัติการ 1,,0
22005053,ฝ่ายอำนวยการปฏิบัติการ 2,,0
22005054,ฝ่ายอำนวยการปฏิบัติการ 3,,0
22005055,ฝ่ายเทคโนโลยีสารสนเทศ,,0
22005056,ศูนย์ปฏิบัติการ กนอ.,,0
22005057,สำนักงานท่าเรืออุตสาหกรรมมาบตาพุด,,0
22005058,สำนักงานนิคมอุตสาหกรรม ทีเอฟดี,,0
22005059,สำนักงานนิคมอุตสาหกรรมบางชัน,,0
22005060,สำนักงานนิคมอุตสาหกรรมบางปะอิน,,0
22005061,สำนักงานนิคมอุตสาหกรรมบางปู,,0
22005062,สำนักงานนิคมอุตสาหกรรมบางพลี,,0
22005063,สำนักงานนิคมอุตสาหกรรมบ้านหว้า,,0
22005064,สำนักงานนิคมอุตสาหกรรมปิ่นทอง,,0
22005065,สำนักงานนิคมอุตสาหกรรมปิ่นทอง (แหลมฉบัง),,0
22005066,สำนักงานนิคมอุตสาหกรรมปิ่นทอง 3,,0
22005067,สำนักงานนิคมอุตสาหกรรมปิ่นทอง 4,,0
22005068,สำนักงานนิคมอุตสาหกรรมปิ่นทอง 5,,0
22005069,สำนักงานนิคมอุตสาหกรรมผาแดง,,0
22005070,สำนักงานนิคมอุตสาหกรรมพิจิตร,,0
22005071,สำนักงานนิคมอุตสาหกรรมภาคเหนือ,,0
22005072,สำนักงานนิคมอุตสาหกรรมภาคใต้,,0
22005073,สำนักงานนิคมอุตสาหกรรมมหาราชนคร,,0
22005074,สำนักงานนิคมอุตสาหกรรมมาบตาพุด,,0
22005075,สำนักงานนิคมอุตสาหกรรมราชบุรี,,0
22005076,สำนักงานนิคมอุตสาหกรรมร่วมดำเนินงานกลุ่มมาบตาพุด,,0
22005077,สำนักงานนิคมอุตสาหกรรมลาดกระบัง,,0
22005078,สำนักงานนิคมอุตสาหกรรมสมุทรสาคร,,0
22005079,สำนักงานนิคมอุตสาหกรรมสหรัตนนคร,,0
22005080,สำนักงานนิคมอุตสาหกรรมสินสาคร,,0
22005081,สำนักงานนิคมอุตสาหกรรมหนองแค,,0
22005082,สำนักงานนิคมอุตสาหกรรมอมตะซิตี้,,0
22005083,สำนักงานนิคมอุตสาหกรรมอมตะนคร,,0
22005084,สำนักงานนิคมอุตสาหกรรมอัญธานี,,0
22005085,สำนักงานนิคมอุตสาหกรรมอาร์ ไอ แอล,,0
22005086,สำนักงานนิคมอุตสาหกรรมอีสเทิร์นซีบอร์ด (ระยอง),,0
22005087,สำนักงานนิคมอุตสาหกรรมเกตเวย์ ซิตี้,,0
22005088,สำนักงานนิคมอุตสาหกรรมเวลโกรว์,,0
22005089,สำนักงานนิคมอุตสาหกรรมเหมราชชลบุรี,,0
22005090,สำนักงานนิคมอุตสาหกรรมเหมราชชลบุรี 2,,0
22005091,สำนักงานนิคมอุตสาหกรรมเหมราชตะวันออก (มาบตาพุด),,0
22005092,สำนักงานนิคมอุตสาหกรรมเหมราชอีสเทิร์นซีบอร์ด,,0
22005093,สำนักงานนิคมอุตสาหกรรมเหมราชอีสเทิร์นซีบอร์ด 2,,0
22005094,สำนักงานนิคมอุตสาหกรรมเอเชีย (สุวรรณภูมิ),,0
22005095,สำนักงานนิคมอุตสาหกรรมเอเซีย,,0
22005096,สำนักงานนิคมอุตสาหกรรมแก่งคอย,,0
22005097,สำนักงานนิคมอุตสาหกรรมแหลมฉบัง,,0
22005098,สำนักงานนิคมอุตสาหกรรมไฮเทค กบินทร,,0
22005099,สำนักงานโครงการพิเศษ,,0
22006001,กองบริการงานสถาบัน,['กบถ.'],0
22006002,กองบริการทางการแพทย์,['กบพ.'],0
22006003,กองบริหารธุรกิจเสริมระบบประปา,['กธป.'],0
22006004,กองวิชาการและข้อมูลผลิตน้ำ,['กวผ.'],0
22006005,กองวิศวกรรมและข้อมูลบำรุงรักษา,['กวร.'],0
22006006,กองสารสนเทศงานบุคคล,['กสบ.'],0
22006007,กองเลขานุการ,['กลน.'],0
22006008,กองแผนยุทธศาสตร์และการต่างประเทศ,['กผต.'],0
22006009,บัญชีผู้ใช้สำหรับพ.ร.ก.เงินกู้ การประปานครหลวง,,0
22006010,ฝ่ายกฎหมาย,['ฝกม.'],0
22006011,ฝ่ายการเงิน,['ฝกง.'],0
22006012,ฝ่ายกิจการคณะกรรมการกปน.,['ฝกค.'],0
22006013,ฝ่ายก่อสร้างระบบจ่ายน้ำ 1,['ฝกจ.1'],0
22006014,ฝ่ายก่อสร้างระบบจ่ายน้ำ 2,['ฝกจ.2'],0
22006015,ฝ่ายก่อสร้างระบบผลิตส่งน้ำและงานโยธา,['ฝกผ.'],0
22006016,ฝ่ายควบคุมการส่งและจ่ายน้ำ,['ฝคจ.'],0
22006017,ฝ่ายคุณภาพน้ำ,['ฝคภ.'],0
22006018,ฝ่ายงบประมาณ,['ฝงป.'],0
22006019,ฝ่ายจัดหาและพัสดุ,['ฝจพ.'],0
22006020,ฝ่ายตรวจสอบกระบวนงานสนับสนุน,['ฝตน.'],0
22006021,ฝ่ายตรวจสอบกระบวนงานหลัก,['ฝตล.'],0
22006022,ฝ่ายติดตามและประเมินผล,['ฝตป.'],0
22006023,ฝ่ายทรัพยากรน้ำและสิ่งแวดล้อม,['ฝนส.'],0
22006024,ฝ่ายธรรมาภิบาล,['ฝธภ.'],0
22006025,ฝ่ายนโยบายและยุทธศาสตร์,['ฝนย.'],0
22006026,ฝ่ายบริการกลาง,['ฝบก.'],0
22006027,ฝ่ายบริหารความรับผิดชอบต่อสังคม,['ฝรส.'],0
22006028,ฝ่ายบริหารความเสี่ยง,['ฝบส.'],0
22006029,ฝ่ายบริหารจัดการน้ำสูญเสีย,['ฝจส.'],0
22006030,ฝ่ายบริหารทรัพยากรบุคคล,['ฝบบ.'],0
22006031,ฝ่ายบริหารโครงการ,['ฝบค.'],0
22006032,ฝ่ายบัญชี,['ฝบช.'],0
22006033,ฝ่ายบำรุงรักษาระบบอัตโนมัติและเครื่องวัด,['ฝบอ.'],0
22006034,ฝ่ายบำรุงรักษาระบบเครื่องกลและโยธา,['ฝบย.'],0
22006035,ฝ่ายบำรุงรักษาระบบไฟฟ้า,['ฝบฟ.'],0
22006036,ฝ่ายปฏิบัติการ การประปานครหลวง,['ฝปก.'],0
22006037,ฝ่ายพัฒนาทรัพยากรบุคคล,['ฝพบ.'],0
22006038,ฝ่ายพัฒนาธุรกิจ,['ฝพธ.'],0
22006039,ฝ่ายพัฒนาระบบงานเสริมสร้างมูลค่ากิจการ,['ฝพส.'],0
22006040,ฝ่ายพัฒนาวิชาการประปา,['ฝพป.'],0
22006041,ฝ่ายพัฒนาและสนับสนุนงานตรวจสอบ,['ฝพน.'],0
22006042,ฝ่ายพัฒนาและสนับสนุนเทคโนโลยี,['ฝพท.'],0
22006043,ฝ่ายมาตรฐานวิศวกรรมและสารสนเทศภูมิศาสตร์,['ฝมส.'],0
22006044,ฝ่ายมาตรวัดน้ำ,['ฝมน.'],0
22006045,ฝ่ายยุทธศาสตร์ด้านเทคโนโลยีสารสนเทศ,['ฝยท.'],0
22006046,ฝ่ายระบบส่งน้ำดิบ,['ฝรด.'],0
22006047,ฝ่ายวางแผนและพัฒนาการผลิตระบบส่งและจ่ายน้ำ,['ฝพผ.'],0
22006048,ฝ่ายวิเคราะห์และวางแผนการเงิน,['ฝวง.'],0
22006049,ฝ่ายสถานีสูบจ่ายน้ำ,['ฝสน.'],0
22006050,ฝ่ายสนับสนุนงานบริการ,['ฝสบ.'],0
22006051,ฝ่ายสวัสดิการและกิจการสัมพันธ์,['ฝสก.'],0
22006052,ฝ่ายสื่อสารองค์กร,['ฝสอ.'],0
22006053,ฝ่ายออกแบบระบบจ่ายน้ำ,['ฝอจ.'],0
22006054,ฝ่ายออกแบบระบบผลิต ส่งน้ำและงานโยธา,['ฝอผ.'],0
22006055,ฝ่ายเทคโนโลยีและสื่อสาร,['ฝยส.'],0
22006056,ฝ่ายโครงการปรับปรุงกิจการประปาแผนหลัก,['ฝคป.'],0
22006057,ฝ่ายโรงงานผลิตน้ำบางเขน,['ฝผข.'],0
22006058,ฝ่ายโรงงานผลิตน้ำมหาสวัสดิ์และธนบุรี,['ฝมธ.'],0
22006059,ฝ่ายโรงงานผลิตน้ำสามเสน,['ฝผส.'],0
22006060,สำนักงานประปาสาขาตากสิน,['สสต.'],0
22006061,สำนักงานประปาสาขาทุ่งมหาเมฆ,['สสท.'],0
