id,official_name,alias_name,total_leaf_node
13012019,สำนักงานกลุ่มภารกิจบริหารความยุติธรรม,,0
13012020,สำนักงานกลุ่มภารกิจพัฒนาพฤตินิสัย,,0
13012021,สำนักงานกลุ่มภารกิจอำนวยความยุติธรรม,,0
13012022,สำนักงานกองทุนยุติธรรม,,0
13012023,สำนักงานคณะกรรมการเสริมสร้างความสมานฉันท์แห่งชาติ,,0
13012024,สำนักงานบริหารโครงการศูนย์การเรียนรู้ระหว่างประเทศด้านกระบวนการยุติธรรม,,0
13012025,สำนักงานประสานงานคณะรักษาความสงบแห่งชาติ,,0
13012026,สำนักงานยุติธรรมจังหวัดกระบี่,,0
13012027,สำนักงานยุติธรรมจังหวัดกาญจนบุรี,,0
13012028,สำนักงานยุติธรรมจังหวัดกาฬสินธ์,,0
13012029,สำนักงานยุติธรรมจังหวัดกำแพงเพชร,,0
13012030,สำนักงานยุติธรรมจังหวัดขอนแก่น,,0
13012031,สำนักงานยุติธรรมจังหวัดจันทบุรี,,0
13012032,สำนักงานยุติธรรมจังหวัดฉะเชิงเทรา,,0
13012033,สำนักงานยุติธรรมจังหวัดชลบุรี,,0
13012034,สำนักงานยุติธรรมจังหวัดชัยนาท,,0
13012035,สำนักงานยุติธรรมจังหวัดชัยภูมิ,,0
13012036,สำนักงานยุติธรรมจังหวัดชุมพร,,0
13012037,สำนักงานยุติธรรมจังหวัดตรัง,,0
13012038,สำนักงานยุติธรรมจังหวัดตราด,,0
13012039,สำนักงานยุติธรรมจังหวัดตาก,,0
13012040,สำนักงานยุติธรรมจังหวัดตาก สาขาแม่สอด,,0
13012041,สำนักงานยุติธรรมจังหวัดนครนายก,,0
13012042,สำนักงานยุติธรรมจังหวัดนครปฐม,,0
13012043,สำนักงานยุติธรรมจังหวัดนครพนม,,0
13012044,สำนักงานยุติธรรมจังหวัดนครราชสีมา,,0
13012045,สำนักงานยุติธรรมจังหวัดนครศรีธรรมราช,,0
13012046,สำนักงานยุติธรรมจังหวัดนครสวรรค์,,0
13012047,สำนักงานยุติธรรมจังหวัดนนทบุรี,,0
13012048,สำนักงานยุติธรรมจังหวัดนราธิวาส,,0
13012049,สำนักงานยุติธรรมจังหวัดน่าน,,0
13012050,สำนักงานยุติธรรมจังหวัดบึงกาฬ,,0
13012051,สำนักงานยุติธรรมจังหวัดบุรีรัมย์,,0
13012052,สำนักงานยุติธรรมจังหวัดปทุมธานี,,0
13012053,สำนักงานยุติธรรมจังหวัดประจวบคีรีขันธ์,,0
13012054,สำนักงานยุติธรรมจังหวัดปราจีนบุรี,,0
13012055,สำนักงานยุติธรรมจังหวัดปัตตานี,,0
13012056,สำนักงานยุติธรรมจังหวัดพระนครศรีอยุธยา,,0
13012057,สำนักงานยุติธรรมจังหวัดพะเยา,,0
13012058,สำนักงานยุติธรรมจังหวัดพังงา,,0
13012059,สำนักงานยุติธรรมจังหวัดพัทลุง,,0
13012060,สำนักงานยุติธรรมจังหวัดพิจิตร,,0
13012061,สำนักงานยุติธรรมจังหวัดพิษณุโลก,,0
13012062,สำนักงานยุติธรรมจังหวัดภูเก็ต,,0
13012063,สำนักงานยุติธรรมจังหวัดมหาสารคาม,,0
13012064,สำนักงานยุติธรรมจังหวัดมุกดาหาร,,0
13012065,สำนักงานยุติธรรมจังหวัดยะลา,,0
13012066,สำนักงานยุติธรรมจังหวัดยะลา สาขาเบตง,,0
13012067,สำนักงานยุติธรรมจังหวัดยโสธร,,0
13012068,สำนักงานยุติธรรมจังหวัดระนอง,,0
13012069,สำนักงานยุติธรรมจังหวัดระยอง,,0
13012070,สำนักงานยุติธรรมจังหวัดราชบุรี,,0
13012071,สำนักงานยุติธรรมจังหวัดร้อยเอ็ด,,0
13012072,สำนักงานยุติธรรมจังหวัดลพบุรี,,0
13012073,สำนักงานยุติธรรมจังหวัดลำปาง,,0
13012074,สำนักงานยุติธรรมจังหวัดลำพูน,,0
13012075,สำนักงานยุติธรรมจังหวัดศรีสะเกษ,,0
13012076,สำนักงานยุติธรรมจังหวัดสกลนคร,,0
13012077,สำนักงานยุติธรรมจังหวัดสงขลา,,0
13012078,สำนักงานยุติธรรมจังหวัดสตูล,,0
13012079,สำนักงานยุติธรรมจังหวัดสมุทรปราการ,,0
13012080,สำนักงานยุติธรรมจังหวัดสมุทรสงคราม,,0
13012081,สำนักงานยุติธรรมจังหวัดสมุทรสาคร,,0
13012082,สำนักงานยุติธรรมจังหวัดสระบุรี,,0
13012083,สำนักงานยุติธรรมจังหวัดสระแก้ว,,0
13012084,สำนักงานยุติธรรมจังหวัดสิงห์บุรี,,0
13012085,สำนักงานยุติธรรมจังหวัดสุพรรณบุรี,,0
13012086,สำนักงานยุติธรรมจังหวัดสุราษฎร์ธานี,,0
13012087,สำนักงานยุติธรรมจังหวัดสุราษฎร์ธานี สาขาเกาะสมุย,,0
13012088,สำนักงานยุติธรรมจังหวัดสุรินทร์,,0
13012089,สำนักงานยุติธรรมจังหวัดสุรินทร์ สาขารัตนบุรี,,0
13012090,สำนักงานยุติธรรมจังหวัดสุโขทัย,,0
13012091,สำนักงานยุติธรรมจังหวัดหนองคาย,,0
13012092,สำนักงานยุติธรรมจังหวัดหนองบัวลำภู,,0
13012093,สำนักงานยุติธรรมจังหวัดอำนาจเจริญ,,0
13012094,สำนักงานยุติธรรมจังหวัดอุดรธานี,,0
13012095,สำนักงานยุติธรรมจังหวัดอุตรดิตถ์,,0
13012096,สำนักงานยุติธรรมจังหวัดอุทัยธานี,,0
13012097,สำนักงานยุติธรรมจังหวัดอุบลราชธานี,,0
13012098,สำนักงานยุติธรรมจังหวัดอ่างทอง,,0
13012099,สำนักงานยุติธรรมจังหวัดเชียงราย,,0
13012100,สำนักงานยุติธรรมจังหวัดเชียงใหม่,,0
13012101,สำนักงานยุติธรรมจังหวัดเชียงใหม่ สาขาฝาง,,0
13012102,สำนักงานยุติธรรมจังหวัดเพชรบุรี,,0
13012103,สำนักงานยุติธรรมจังหวัดเพชรบูรณ์,,0
13012104,สำนักงานยุติธรรมจังหวัดเลย,,0
13012105,สำนักงานยุติธรรมจังหวัดแพร่,,0
13012106,สำนักงานยุติธรรมจังหวัดแม่ฮ่องสอน,,0
13012107,สำนักงานส่งเสริมสัมมาชีพและผลิตภัณฑ์เพื่อการพัฒนาพฤตินิสัย,,0
13012108,สำนักบังคับคดีอาญาและบังคับใช้กฎหมาย,,0
13012109,สำนักผู้ตรวจราชการกระทรวงยุติธรรม,,0
13012110,สำนักพัฒนาบุคลากรกระทรวงยุติธรรม,,0
13013001,กลุ่มงานประสานการเมือง,,0
13013002,กลุ่มงานสนับสนุนวิชาการ,,0
13013003,กลุ่มบริหารงานทั่วไป,,0
13013004,สำนักงานบริหารโครงการภายใต้บันทึกความเข้าใจว่าด้วยความร่วมมือระหว่างรัฐบาลแห่งราชอาณาจักรไทยกับรัฐบาลแห่งสาธารณรัฐประชาชนจีน ด้านการพัฒนาโครงสร้างพื้นฐานทางรถไฟของประเทศไทย,['สบร.'],0
13013005,สำนักงานรัฐมนตรี,,0
14001001,กลุ่มตรวจสอบภายในระดับกรม,,0
14001002,กลุ่มพัฒนาระบบบริหาร,,0
14001003,กองศาสนูปถัมภ์,,0
14001004,บัญชีผู้ใช้สำหรับพ.ร.ก.เงินกู้ กรมการศาสนา,,0
14001005,สำนักงานขับเคลื่อนแผนแม่บทส่งเสริมคุณธรรมแห่งชาติ,,0
14001006,สำนักงานส่งเสริมชุมชนคุณธรรม,,0
14001007,สำนักพัฒนาคุณธรรมจริยธรรม,,0
14001008,สำนักเลขานุการกรม,,0
14002001,กลุ่มตรวจสอบภายใน,,0
14002002,กลุ่มพัฒนาระบบบริหาร,,0
14002003,กองโบราณคดี,,0
14002004,กองโบราณคดีใต้น้ำ,,0
14002005,บัญชีผู้ใช้สำหรับพ.ร.ก.เงินกู้ กรมศิลปากร,,0
14002006,พิพิธภัณฑสถานแห่งชาติกำแพงเพชร,,0
14002007,พิพิธภัณฑสถานแห่งชาติจันทรเกษม,,0
14002008,พิพิธภัณฑสถานแห่งชาติชัยนาทมุนี,,0
14002009,พิพิธภัณฑสถานแห่งชาติชาวนาไทย,,0
14002010,พิพิธภัณฑสถานแห่งชาติชุมพร,,0
14002011,พิพิธภัณฑสถานแห่งชาติถลาง,,0
14002012,พิพิธภัณฑสถานแห่งชาติน่าน,,0
14002013,พิพิธภัณฑสถานแห่งชาติบ้านเก่า,,0
14002014,พิพิธภัณฑสถานแห่งชาติบ้านเชียง,,0
14002015,พิพิธภัณฑสถานแห่งชาติปราจีนบุรี,,0
14002016,พิพิธภัณฑสถานแห่งชาติพระนครคีรี,,0
14002017,พิพิธภัณฑสถานแห่งชาติพระปฐมเจดีย์,,0
14002018,พิพิธภัณฑสถานแห่งชาติพระพุทธชินราช,,0
14002019,พิพิธภัณฑสถานแห่งชาติพิมาย,,0
14002020,พิพิธภัณฑสถานแห่งชาติมหาวีรวงศ์,,0
14002021,พิพิธภัณฑสถานแห่งชาติราชบุรี,,0
14002022,พิพิธภัณฑสถานแห่งชาติรามคำแหง,,0
14002023,พิพิธภัณฑสถานแห่งชาติร้อยเอ็ด,,0
14002024,พิพิธภัณฑสถานแห่งชาติวัดมัชณิมาวาส,,0
14002025,พิพิธภัณฑสถานแห่งชาติสงขลา,,0
14002026,พิพิธภัณฑสถานแห่งชาติสตูล,,0
14002027,พิพิธภัณฑสถานแห่งชาติ สมเด็จพระนารายณ์,,0
14002028,พิพิธภัณฑสถานแห่งชาติสวรรควรนายก,,0
14002029,พิพิธภัณฑสถานแห่งชาติสุพรรณบุรี,,0
14002030,พิพิธภัณฑสถานแห่งชาติสุรินทร์,,0
14002031,พิพิธภัณฑสถานแห่งชาติหริภุญไชย,,0
14002032,พิพิธภัณฑสถานแห่งชาติอุบลราชธานี,,0
14002033,พิพิธภัณฑสถานแห่งชาติอู่ทอง,,0
14002034,พิพิธภัณฑสถานแห่งชาติเจ้าสามพระยา,,0
14002035,พิพิธภัณฑสถานแห่งชาติเชียงแสน,,0
14002036,พิพิธภัณฑสถานแห่งชาติเชียงใหม่,,0
14002037,พิพิธภัณฑสถานแห่งชาติไชยา,,0
14002038,พิพิธภัณฑ์สถานแห่งชาติ กาญจนาภิเษก,,0
14002039,พิพิธภัณฑ์สถานแห่งชาติขอนแก่น,,0
14002040,พิพิธภัณฑ์สถานแห่งชาตินครศรีธรรมราช,,0
14002041,พิพิธภัณฑ์สถานแห่งชาติพาณิชย์นาวี,,0
14002042,พิพิธภัณฑ์สถานแห่งชาติอินทร์บุรี,,0
14002043,ศูนย์เทคโนโลยีสารสนเทศมรดกศิลปวัฒนธรรม,,0
14002044,สำนักการสังคีต,,0
14002045,สำนักงานอุทยานประวัติศาสตร์พนมรุ้ง,,0
14002046,สำนักจดหมายเหตุแห่งชาติ,,0
14002047,สำนักช่างสิบหมู่,,0
14002048,สำนักบริหารกลาง,,0
14002049,สำนักพิพิธภัณฑสถานแห่งชาติ,,0
14002050,สำนักวรรณกรรมและประวัติศาสตร์,,0
14002051,สำนักศิลปากรที่ 10 นครราชสีมา,,0
14002052,สำนักศิลปากรที่ 11 สงขลา,,0
14002053,สำนักศิลปากรที่ 12 นครศรีธรรมราช,,0
14002054,สำนักศิลปากรที่ 1 ราชบุรี,,0
14002055,สำนักศิลปากรที่ 2 สุพรรณบุรี,,0
14002056,สำนักศิลปากรที่ 3 พระนครศรีอยุธยา,,0
14002057,สำนักศิลปากรที่ 4 ลพบุรี,,0
14002058,สำนักศิลปากรที่ 5 ปราจีนบุรี,,0
14002059,สำนักศิลปากรที่ 6 สุโขทัย,,0
14002060,สำนักศิลปากรที่ 7 เชียงใหม่,,0
14002061,สำนักศิลปากรที่ 8 ขอนแก่น,,0
14002062,สำนักศิลปากรที่ 9 อุบลราชธานี,,0
14002063,สำนักสถาปัตยกรรม,,0
14002064,สำนักหอสมุดแห่งชาติ,,0
14002065,หอจดหมายเหตุแห่งชาติ จังหวัดจันทบุรี,,0
14002066,หอจดหมายเหตุแห่งชาติ จังหวัดสุพรรณบุรี,,0
14002067,หอจดหมายเหตุแห่งชาตินายกรัฐมนตรี พลเอกเปรม ติณสูลานนท์,,0
14002068,หอจดหมายเหตุแห่งชาติเฉลิมพระเกียรติพระบาทสมเด็จพระเจ้าอยู่หัว,,0
14002069,หอจดหมายเหตุแห่งชาติเฉลิมพระเกียรติ สมเด็จพระนางเจ้าสิริกิติ์ฯ ตรัง,,0
14002070,หอจดหมายเหตุแห่งชาติเฉลิมพระเกียรติ สมเด็จพระนางเจ้าสิริกิติ์ฯ ยะลา,,0
14002071,หอจดหมายเหตุแห่งชาติเฉลิมพระเกียรติ สมเด็จพระนางเจ้าสิริกิติ์ฯ สงขลา,,0
14002072,หอจดหมายเหตุแห่งชาติเฉลิมพระเกียรติ สมเด็จพระนางเจ้าสิริกิติ์ฯ เชียงใหม่,,0
14002073,หอจดหมายเหตุแห่งชาติเฉลิมพระเกียรติ สมเด็จพระบรมโอรสาธิราชฯ สยามมกุฎราชกุมาร พะเยา,,0
14002074,หอจดหมายเหตุแห่งชาติเฉลิมพระเกียรติ สมเด็จพระบรมโอรสาธิราชฯ สยามมกุฎราชกุมาร อุบลราชธานี,,0
14002075,หอสมุดแห่งชาติกาญจนาภิเษก สงขลา,,0
14002076,หอสมุดแห่งชาติจังหวัดสุพรรณบุรี เฉลิมพระเกียรติ,,0
14002077,หอสมุดแห่งชาติชลบุรี,,0
14002078,หอสมุดแห่งชาตินครศรีธรรมราช,,0
14002079,หอสมุดแห่งชาติรัชมังคลาภิเษก กาญจนบุรี,,0
14002080,หอสมุดแห่งชาติรัชมังคลาภิเษก จันทบุรี,,0
14002081,หอสมุดแห่งชาติรัชมังคลาภิเษก เชียงใหม่,,0
14002082,หอสมุดแห่งชาติอินทร์บุรี,,0
14002083,หอสมุดแห่งชาติเฉลิมพระเกียรติ ร.9 นครราชสีมา,,0
14002084,หอสมุดแห่งชาติเฉลิมพระเกียรติ สมเด็จพระนางเจ้าสิริกิติ์ฯ ตรัง,,0
14002085,หอสมุดแห่งชาติเฉลิมพระเกียรติ สมเด็จพระนางเจ้าสิริกิติ์ฯ นครพนม,,0
14002086,หอสมุดแห่งชาติเฉลิมพระเกียรติ สมเด็จพระนางเจ้าสิริกิติ์ฯ สงขลา,,0
14002087,หอเกียรติยศ ฯพณฯ บรรหาร ศิลปอาชา นายกรัฐมนตรีคนที่ 21,,0
14002088,อุทยานประวัติศาสตร์กำแพงเพชร,,0
14002089,อุทยานประวัติศาสตร์พระนครคีรี,,0
14002090,อุทยานประวัติศาสตร์พระนครศรีอยุธยา,,0
14002091,อุทยานประวัติศาสตร์พิมาย,,0
14002092,อุทยานประวัติศาสตร์ภูพระบาท,,0
14002093,อุทยานประวัติศาสตร์ศรีสัชนาลัย,,0
14002094,อุทยานประวัติศาสตร์ศรีเทพ,,0
14002095,อุทยานประวัติศาสตร์สุโขทัย,,0
14002096,อุทยานประวัติศาสตร์เมืองสิงห์,,0
14003001,กลุ่มงานที่รายงานตรง,,0
14003002,กองกองทุนส่งเสริมงานวัฒนธรรม,,0
14003003,กองกิจการเครือข่ายทางวัฒนธรรม,,0
14003004,บัญชีผู้ใช้สำหรับพ.ร.ก.เงินกู้ กรมส่งเสริมวัฒนธรรม,,0
14003005,ศูนย์วัฒนธรรมแห่งประเทศไทย,,0
14003006,สถาบันวัฒนธรรมศึกษา,,0
14003007,สำนักงานเลขานุการกรม,,0
14003008,สำนักพิจารณาภาพยนต์และวีดิทัศน์,,0
14003009,ส่วนกลาง,,0
14003010,หออัครศิลปิน,,0
14004001,ฝ่ายนโยบายและยุทธศาสตร์,,0
14005001,บัญชีผู้ใช้สำหรับพ.ร.ก.เงินกู้ ศูนย์คุณธรรม (องค์การมหาชน),,0
14005002,ศูนย์คุณธรรม (องค์การมหาชน),,0
14006001,บัญชีผู้ใช้สำหรับพ.ร.ก.เงินกู้ ศูนย์มานุษยวิทยาสิรินธร (องค์การมหาชน),,0
14006002,ศูนย์มานุษยวิทยาสิรินธร (องค์การมหาชน),,0
14007001,คณะศิลปนาฏดุริยางค์,,0
14007002,คณะศิลปวิจิตร,,0
14007003,คณะศิลปศึกษา,,0
14007004,บัญชีผู้ใช้สำหรับพ.ร.ก.เงินกู้ สถาบันบัณฑิตพัฒนศิลป์,,0
14007005,วิทยัลช่างศิลปนครศรีธรรมราช,,0
14007006,วิทยาลัยช่างศิลป,,0
14007007,วิทยาลัยช่างศิลปสุพรรณบุรี,,0
14007008,วิทยาลัยนาฏศิลป,,0
14007009,วิทยาลัยนาฏศิลปกาฬสินธุ์,,0
14007010,วิทยาลัยนาฏศิลปจันทบุรี,,0
14007011,วิทยาลัยนาฏศิลปนครราชสีมา,,0
14007012,วิทยาลัยนาฏศิลปนครศรีธรรมราช,,0
14007013,วิทยาลัยนาฏศิลปพัทลุง,,0
14007014,วิทยาลัยนาฏศิลปร้อยเอ็ด,,0
14007015,วิทยาลัยนาฏศิลปลพบุรี,,0
14007016,วิทยาลัยนาฏศิลปสุพรรณบุรี,,0
14007017,วิทยาลัยนาฏศิลปสุโขทัย,,0
14007018,วิทยาลัยนาฏศิลปอ่างทอง,,0
14007019,วิทยาลัยนาฏศิลปเชียงใหม่,,0
14007020,สำนักงานอธิการบดีสถาบันบัณฑิตพัฒนศิลป์,,0
14008001,กลุ่มตรวจสอบภายในระดับกระทรวง,,0
14008002,กลุ่ม ป.ย.ป. ในกระทรวงวัฒนธรรม,,0
14008003,กลุ่มพัฒนาระบบบริหาร,,0
